"","By Aragon (26-March-2025) #","Companion Enhancement","Benefit","Damage at base monster stats","","","","","","","","","","","","","","","","","","","",""
"","1","Armor Break (Cave Bear)","-9% to enemies Defense (at 50% defense)","6.38%","","","","","","","","","","","","","","","","","","","",""
"","2","Dulled Senses (Renegrade Illusionist)","-9% to enemies Awareness","4.09%","","","","","","","","","","","","","","","","","","","",""
"","3","Vulnerability (Halfling Wayward Wizard)","-9% to enemies Critical Avoidance","3.89%","","","","","","","","","","","","","","","","","","","",""
"","4","Slowed Reactions (Apprentice Healer, 2gp)","-9% to enemies Deflect (at 90% accuracy, only useful when not capped))","0.00%","","","","","","","","","","","","","","","","","","","",""
"","5","Advantage Nulification (Portobello)","-9% to enemies Combat Advantage (reliable survivability)","","","","","","","","","","","","","","","","","","","","",""
"","6","Weapon Break (Man at Arms, 2gp)","-9% to enemies Critical Severity (survivability against crits)","","","","","","","","","","","","","","","","","","","","",""
